[
  {
    "name": "Commit0",
    "year": 2024,
    "paper": "https://arxiv.org/abs/2412.01769",
    "code": "",
    "dataset": "",
    "langs": ["Python"],
    "tasks": ["End-to-end library generation from specs with interactive feedback (tests, static analysis, coverage)"],
    "runner": "exec",
    "size": {"repos": 54, "tasks": 54},
    "license": "",
    "notes": ""
  },
  {
    "name": "SketchEval",
    "year": 2024,
    "paper": "https://arxiv.org/abs/2403.16443",
    "code": "",
    "dataset": "",
    "langs": ["Python"],
    "tasks": ["NL2Repo repository generation (3-stage pipeline: RepoSketcher, FileSketcher, SketchFiller)"],
    "runner": "proxy",
    "size": {"repos": 19, "tasks": 19},
    "license": "",
    "notes": ""
  },
  {
    "name": "HumanEvo",
    "year": 2025,
    "paper": "https://arxiv.org/abs/2406.06918",
    "code": "",
    "dataset": "",
    "langs": ["Python", "Java"],
    "tasks": ["Evolution-aware repo-level code generation (time-aware context, exec tests)"],
    "runner": "exec",
    "size": {"repos": 0, "tasks": 400},
    "license": "",
    "notes": ""
  },
  {
    "name": "MRG-Bench",
    "year": 2025,
    "paper": "https://arxiv.org/abs/2508.02998",
    "code": "",
    "dataset": "",
    "langs": ["Python", "Java", "Go"],
    "tasks": ["Multi-language repository-level code generation (project-runnable tests)"],
    "runner": "exec",
    "size": {"repos": 0, "tasks": 0},
    "license": "",
    "notes": ""
  },
  {
    "name": "RepoClassBench",
    "year": 2024,
    "paper": "https://arxiv.org/html/2405.01573v2",
    "code": "",
    "dataset": "",
    "langs": ["Java", "Python", "C#"],
    "tasks": ["Class generation inside real repos (with cross-file deps & tests)"],
    "runner": "exec",
    "size": {"repos": 0, "tasks": 287},
    "license": "",
    "notes": ""
  },
  {
    "name": "ProjectEval",
    "year": 2025,
    "paper": "https://arxiv.org/abs/2503.07010",
    "code": "",
    "dataset": "",
    "langs": ["Python"],
    "tasks": ["Project-level programming agent evaluation (automated exec + user-interaction simulation)"],
    "runner": "exec",
    "size": {"repos": 0, "tasks": 20},
    "license": "",
    "notes": ""
  },
  {
    "name": "CodeAgentBench",
    "year": 2024,
    "paper": "https://arxiv.org/abs/2401.07339",
    "code": "",
    "dataset": "",
    "langs": ["Python"],
    "tasks": ["Repo-level code generation with tool-integrated agent (5 projects, 101 samples)"],
    "runner": "exec",
    "size": {"repos": 5, "tasks": 101},
    "license": "",
    "notes": ""
  },
  {
    "name": "EvoCodeBench",
    "year": 2024,
    "paper": "https://arxiv.org/abs/2404.00599",
    "code": "",
    "dataset": "",
    "langs": ["Python"],
    "tasks": ["Evolving repository-aligned codegen benchmark (reduces time-leakage)"],
    "runner": "exec",
    "size": {"repos": 25, "tasks": 275},
    "license": "",
    "notes": ""
  },
  {
    "name": "DevEval",
    "year": 2024,
    "paper": "https://arxiv.org/abs/2405.19856",
    "code": "",
    "dataset": "",
    "langs": ["Python"],
    "tasks": ["Repository-level code generation on real repos (manual annotations of requirements)"],
    "runner": "exec",
    "size": {"repos": 117, "tasks": 1874},
    "license": "",
    "notes": ""
  },
  {
    "name": "RepoExec",
    "year": 2024,
    "paper": "https://arxiv.org/abs/2406.11927v2",
    "code": "",
    "dataset": "",
    "langs": ["Python"],
    "tasks": ["Repo-level code generation with explicit dependencies (executable benchmark)"],
    "runner": "exec",
    "size": {"repos": 0, "tasks": 0},
    "license": "",
    "notes": ""
  },
  {
    "name": "ProjectTest",
    "year": 2025,
    "paper": "https://arxiv.org/abs/2502.06556",
    "code": "",
    "dataset": "",
    "langs": ["Python", "Java", "JavaScript"],
    "tasks": ["Project-level unit test generation across multi-file projects"],
    "runner": "exec",
    "size": {"repos": 60, "tasks": 60},
    "license": "",
    "notes": ""
  },
  {
    "name": "SWT-Bench",
    "year": 2024,
    "paper": "https://proceedings.neurips.cc/paper_files/paper/2024/hash/94f093b41fc2666376fb1f667fe282f3-Abstract-Conference.html",
    "code": "",
    "dataset": "",
    "langs": ["Python"],
    "tasks": ["Repo-grounded bug reproduction via test generation and validation"],
    "runner": "exec",
    "size": {"repos": 0, "tasks": 0},
    "license": "",
    "notes": ""
  },
  {
    "name": "RefactorBench",
    "year": 2025,
    "paper": "https://arxiv.org/abs/2503.07832",
    "code": "",
    "dataset": "",
    "langs": ["Python"],
    "tasks": ["Multi-file refactoring tasks (stateful, long-horizon agent edits)"],
    "runner": "proxy",
    "size": {"repos": 9, "tasks": 100},
    "license": "",
    "notes": ""
  },
  {
    "name": "SWE-Perf",
    "year": 2025,
    "paper": "https://arxiv.org/html/2507.12415v1",
    "code": "",
    "dataset": "",
    "langs": ["Python"],
    "tasks": ["Repo-level performance optimization (improve runtime via PR patches)"],
    "runner": "exec",
    "size": {"repos": 9, "tasks": 140},
    "license": "",
    "notes": ""
  },
  {
    "name": "RES-Q",
    "year": 2024,
    "paper": "https://arxiv.org/abs/2406.16801",
    "code": "",
    "dataset": "",
    "langs": ["Python", "JavaScript"],
    "tasks": ["Natural-language repo editing (patching) verified by tests"],
    "runner": "exec",
    "size": {"repos": 14, "tasks": 100},
    "license": "",
    "notes": ""
  },
  {
    "name": "SWE-bench",
    "year": 2024,
    "paper": "https://arxiv.org/abs/2310.06770",
    "code": "",
    "dataset": "",
    "langs": ["Python"],
    "tasks": ["Resolve real GitHub issues by editing repos to make tests pass"],
    "runner": "exec",
    "size": {"repos": 12, "tasks": 2294},
    "license": "",
    "notes": ""
  },
  {
    "name": "SWE-bench-Live",
    "year": 2025,
    "paper": "",
    "code": "",
    "dataset": "https://swe-bench-live.github.io/",
    "langs": ["Python"],
    "tasks": ["Continuously updating repo-level issue resolution benchmark (monthly refreshes)"],
    "runner": "exec",
    "size": {"repos": 164, "tasks": 1565},
    "license": "",
    "notes": ""
  },
  {
    "name": "Multi-SWE-bench",
    "year": 2025,
    "paper": "https://arxiv.org/pdf/2504.02605",
    "code": "",
    "dataset": "",
    "langs": ["Java", "TypeScript", "JavaScript", "Go", "Rust", "C", "C++"],
    "tasks": ["Multilingual repo-level issue resolution (patch generation) across 7 languages"],
    "runner": "exec",
    "size": {"repos": 0, "tasks": 1632},
    "license": "",
    "notes": ""
  },
  {
    "name": "SWE-Bench+",
    "year": 2024,
    "paper": "https://arxiv.org/abs/2410.06992",
    "code": "",
    "dataset": "",
    "langs": ["Python"],
    "tasks": ["Audit and improve SWE-bench data quality (leakage/weak-test analysis)"],
    "runner": "exec",
    "size": {"repos": 0, "tasks": 0},
    "license": "",
    "notes": ""
  },
  {
    "name": "OmniGIRL",
    "year": 2025,
    "paper": "https://arxiv.org/abs/2505.04606",
    "code": "",
    "dataset": "",
    "langs": ["Python", "JavaScript", "TypeScript", "Java"],
    "tasks": ["Multilingual & multimodal issue resolution (text+images)"],
    "runner": "exec",
    "size": {"repos": 0, "tasks": 959},
    "license": "",
    "notes": ""
  },
  {
    "name": "Breakpoint",
    "year": 2025,
    "paper": "https://arxiv.org/abs/2506.00172",
    "code": "",
    "dataset": "",
    "langs": ["Python"],
    "tasks": ["Repo-context code repair via synthetic inverse corruptions (with tests)"],
    "runner": "exec",
    "size": {"repos": 30, "tasks": 930},
    "license": "",
    "notes": ""
  },
  {
    "name": "RepoBench",
    "year": 2024,
    "paper": "https://arxiv.org/abs/2306.03091",
    "code": "",
    "dataset": "",
    "langs": ["Python", "Java"],
    "tasks": ["Repo-level code autocompletion across files (with retrieval, next-line, pipeline)"],
    "runner": "proxy",
    "size": {"repos": 0, "tasks": 0},
    "license": "",
    "notes": ""
  },
  {
    "name": "CrossCodeEval",
    "year": 2023,
    "paper": "https://arxiv.org/abs/2310.11248",
    "code": "",
    "dataset": "",
    "langs": ["Python", "Java", "TypeScript", "C#"],
    "tasks": ["Cross-file code completion and retrieval evaluation (10k examples, ~1k repos)"],
    "runner": "proxy",
    "size": {"repos": 1000, "tasks": 10000},
    "license": "permissive",
    "notes": ""
  },
  {
    "name": "R2C2-Coder",
    "year": 2024,
    "paper": "https://arxiv.org/abs/2406.01359",
    "code": "",
    "dataset": "",
    "langs": ["Python", "Java", "TypeScript", "C#"],
    "tasks": ["Repo-level code completion with retrieval-augmented prompts (R2C2-Bench & Enhance)"],
    "runner": "proxy",
    "size": {"repos": 0, "tasks": 0},
    "license": "",
    "notes": ""
  },
  {
    "name": "M2RC-Eval",
    "year": 2025,
    "paper": "https://arxiv.org/abs/2410.21157",
    "code": "",
    "dataset": "",
    "langs": ["C", "C#", "C++", "Go", "HTML", "Haskell", "Java", "JavaScript", "Kotlin", "Lua", "Objective-C", "PHP", "Python", "R", "Ruby", "Rust", "Scala", "TypeScript"],
    "tasks": ["Massively multilingual repo-level code completion with fine-grained labels (18 languages)"],
    "runner": "proxy",
    "size": {"repos": 0, "tasks": 9000},
    "license": "",
    "notes": ""
  },
  {
    "name": "RepoEval",
    "year": 2023,
    "paper": "https://arxiv.org/abs/2303.12570",
    "code": "",
    "dataset": "",
    "langs": ["Python"],
    "tasks": ["Repo-level code completion via iterative retrieval-generation (line, API, function)"],
    "runner": "mixed",
    "size": {"repos": 0, "tasks": 0},
    "license": "open-source",
    "notes": ""
  },
  {
    "name": "RepoMasterEval",
    "year": 2024,
    "paper": "https://arxiv.org/abs/2408.03519",
    "code": "",
    "dataset": "",
    "langs": ["Python", "TypeScript"],
    "tasks": ["Test-validated code completion in real repos (with mutation testing)"],
    "runner": "exec",
    "size": {"repos": 0, "tasks": 0},